{"broker_operation_id":"8cf5d6b1-8073-515a-aca3-2ffc6361a904","canary_id":"9832c47c-dee2-4c74-9851-311ffc574ab2","central_kaggle_adapter_instances":1,"cleanup":[{"claim_sha256":"da735891c18aedb616408e95c47c2edbcb7d6619f636cf72e25951ba198f674d","detail_code":"task_created_resource_absent","kind":"notebook","outcome":"applied","provider_ref":"zigomaro/mdh-broker-verifier-9832c47cdee2","receipt_sha256":"49381b2711814235c83206522b6fe4f4ddb9a7ea6e9e357531465b3ff52b789a"},{"claim_sha256":"6ff30d5dd1ca9f475ba60423d6193edc80028e3e47a741e8ae7ec363e4321d2b","detail_code":"task_created_resource_absent","kind":"dataset","outcome":"applied","provider_ref":"zigomaro/mdh-broker-canary-9832c47cdee2","receipt_sha256":"b212d9e979dd81e7d56d47808d90123b48220f82000191dfe597c1e634386f5e"},{"claim_sha256":"4df2cc57e5a23f390db4bcbb8ecf77c573418b67896b794f2c292373d57baf8f","detail_code":"task_created_resource_absent","kind":"notebook","outcome":"applied","provider_ref":"zigomaro/mdh-broker-producer-9832c47cdee2","receipt_sha256":"e95aec68abb17b005cee0b514a29ca90d6918d70d461de18e7744be2a39ec677"}],"commit_sha":"0cc28e89682a202d7c15e5616ae2308785629f5f","completed_at":"2026-08-11T23:51:49.159068Z","data_path":"credential_free_notebook_to_signed_kaggle_blob","dataset":{"byte_size":4096,"claim_sha256":"6ff30d5dd1ca9f475ba60423d6193edc80028e3e47a741e8ae7ec363e4321d2b","exact_version_ref":"zigomaro/mdh-broker-canary-9832c47cdee2/1","file_name":"broker-canary.bin","file_sha256":"9d0cf18a9b0f2bd42e7f91f0e27a8fce9b4c91b330291c9ed57f56822ab7d233","manifest_sha256":"040a5ac6ff1162af12e89992df02332cb20aca8693b706967fc479b7046ee8ca","metadata_sha256":"26bab1af3de7cf0be8c4bc724ad7931d594c957fb800584dc814deb4a77a4374","privacy":"private","provider_ref":"zigomaro/mdh-broker-canary-9832c47cdee2","provider_version":1},"devstand_checkpoint_bytes":0,"epoch":1,"evidence_origin":"observed","execution_mode":"live","inventory_absent":true,"inventory_sha256":"17500d2e9db8b79f8544ac1a13abb8b0ab1736dcf850143317728f857ad39b91","live_provider_mutations":true,"outcome":"PASS","producer":{"credential_free":true,"output_receipt_sha256":"20fbb731b95358cafdc720286de96de8d859a23b2bf59dde347bb3837cd303b1","output_tree_sha256":"1e637424a165d774445c9327f7b426195bdf6080c54c37d3ead495e831bd6aab","provider_kernel_id":130485704,"provider_ref":"zigomaro/mdh-broker-producer-9832c47cdee2","provider_run_ref":"zigomaro/mdh-broker-producer-9832c47cdee2/1","result_sha256":"854b319f2030203d8159a219ee7fab62dadf7b18c236c0433356db3e86bd4923","source_sha256":"2a43ff1b6f9c0d00af1aa859d0b3109100d166de18cf6710e4a84f499a30b1dd","source_version":1},"schema_version":"my-data-hub-broker-live-canary-receipt.v1","secret_scan_passed":true,"started_at":"2026-08-11T23:50:03.978911Z","task_id":"94dc77ea-e4ea-5004-969b-325aa50329c2","verifier":{"credential_free":true,"output_receipt_sha256":"7f45fca48d88cc1c654cb1c2c2b794075b31981879b18ce1e2bc6cb6dc3fd579","output_tree_sha256":"b1a5d3ea2cc6da6a2bfa0b241d99e5605e380c23c61e429d54125f05f6fe4050","provider_kernel_id":130485733,"provider_ref":"zigomaro/mdh-broker-verifier-9832c47cdee2","provider_run_ref":"zigomaro/mdh-broker-verifier-9832c47cdee2/1","result_sha256":"a097c1990f660fd7825b1d15915671eb6ae4d4927ee829e1537776af6be1afa0","source_sha256":"176b342f3b69c0fd9a8e3187fdc1ac8a302dd1a668aee71c8c673ca7db01720d","source_version":1}}