{"broker_operation_id":"90d723b9-d33a-58c2-815a-833856fe2f73","canary_id":"9d25da53-6631-43d1-9cc9-97181f4390c6","central_kaggle_adapter_instances":1,"cleanup":[{"claim_sha256":"bfc7613078e98956b8d74dfd589fa729ebdb8399b36e5704aa01e12ae3b6803b","detail_code":"task_created_resource_absent","kind":"notebook","outcome":"applied","provider_ref":"zigomaro/mdh-broker-verifier-9d25da536631","receipt_sha256":"f14957d4d9cffb67c3fd312fd8cde298811fa4f60fa912dfbc857fb93eedc62a"},{"claim_sha256":"b74fc32ed8b6aba8309582b038d2ddefdd4b2a878cf192d16a6ec2f6f78a670c","detail_code":"task_created_resource_absent","kind":"dataset","outcome":"applied","provider_ref":"zigomaro/mdh-broker-canary-9d25da536631","receipt_sha256":"1612d2615eafe3a85aa78542f02f5d02a9892cadbe552b987562a51b3d09ca7f"},{"claim_sha256":"be3b09607f15747fd4513c00c3dfef70db6f6e803651d478ade6bc3ae07a8047","detail_code":"task_created_resource_absent","kind":"notebook","outcome":"applied","provider_ref":"zigomaro/mdh-broker-producer-9d25da536631","receipt_sha256":"e5a5d270cd45dc484c38b26c6ffc126109b5b6828372ec8f6fa44672733fb9cf"}],"commit_sha":"7035dd3615dcbef1239060aabe6872535b240470","completed_at":"2026-08-12T05:36:09.118947Z","data_path":"credential_free_notebook_to_signed_kaggle_blob","dataset":{"byte_size":4096,"claim_sha256":"b74fc32ed8b6aba8309582b038d2ddefdd4b2a878cf192d16a6ec2f6f78a670c","exact_version_ref":"zigomaro/mdh-broker-canary-9d25da536631/1","file_name":"broker-canary.bin","file_sha256":"568ec3891592f21a6d6ea1782faeafe754b2b6b5bb6dfa9fa8e77ea73a80995c","manifest_sha256":"6b920167f93d10e3c474203800e5c69b5fc465c81df5fb1b61c085a57b9192ce","metadata_sha256":"b4d6bf73e92ed9401f83122a4534dd51eb226392fa8184096ca2ddc8c4d8cf1c","privacy":"private","provider_ref":"zigomaro/mdh-broker-canary-9d25da536631","provider_version":1},"devstand_checkpoint_bytes":0,"epoch":1,"evidence_origin":"observed","execution_mode":"live","inventory_absent":true,"inventory_sha256":"1ff13b3d89a546717878aa1cafe70b41786d993bb116ca6b0eba652d729ed7a0","live_provider_mutations":true,"outcome":"PASS","producer":{"credential_free":true,"output_receipt_sha256":"4c893790eb4cc8114d984deb48fbb57c7ae98c2dcf06678b5b289a05ebfe8c19","output_tree_sha256":"e9fcbb648d6b8a7b8cc1503cf6591ced4bd5edaa419ddf9e3422f163989b7ce7","provider_kernel_id":130505195,"provider_ref":"zigomaro/mdh-broker-producer-9d25da536631","provider_run_ref":"zigomaro/mdh-broker-producer-9d25da536631/1","result_sha256":"bdc8000dcb8f4a105bbffee73171d5a230be7c8efbdf2dea6397042b2efd7736","source_sha256":"456c93e6cca25c39807613affd686e652d5da373b05d08edbd17146aa3e5cafe","source_version":1},"schema_version":"my-data-hub-broker-live-canary-receipt.v1","secret_scan_passed":true,"started_at":"2026-08-12T05:34:41.454902Z","task_id":"ccf246de-d2bb-50a3-8792-1bde9e18412c","verifier":{"credential_free":true,"output_receipt_sha256":"46cd6f8f51db2ba1b29dfb39cb5a3359c6cc15b272f7372a964a8929fddb9968","output_tree_sha256":"42f6d7529e826f8431060aa1fc7357237a33f6741060a760e82f3c86250966f7","provider_kernel_id":130505235,"provider_ref":"zigomaro/mdh-broker-verifier-9d25da536631","provider_run_ref":"zigomaro/mdh-broker-verifier-9d25da536631/1","result_sha256":"236063dd21f65f984f1e0502b9f15973602072fb78bab93f8f13cbb244b5d736","source_sha256":"7a5d85ad7ecefff5e932c7c272fbe067deb0f3b9a3b2e0393557ea92a3d8b372","source_version":1}}